{
    "id": "1234",
    "file_name": "1234.pdf",
    "method": "MD-ABCD-123",
    "method_version": "1",
    "start_date": "2018-03-15T17:07:07.245Z",
    "end_date": "2018-03-16T17:07:07.245Z",
    "status": "Completed",
    "last_updated_by": "Jeff",
    "last_updated_date": "2018-03-15T17:07:07.245Z",
    "created_by": "George",
    "created_date": "2018-03-15T17:07:07.245Z",
    "samples": [
        {
            "id": "ABC-123",
            "lot_number": "T001A0318ABC",
            "specification": "Report Result",
            "result": "<0.050 EU/mL",
            "last_updated_by": "James",
            "last_updated_date": "2018-03-15T17:07:07.245Z",
            "serial_number": "1",
            "requested_by": "Jim",
            "requested_by_date": "2018-03-15T17:07:07.245Z",
            "assigned_by": "John",
            "assigned_by_date": "2018-03-15T17:07:07.245Z",
            "project": "Manufacture of ABC123",
            "cd_number": "ADS-345",
            "client_name": "ABC Biotech Co",
            "client_id": "0012",
            "serotype": "AB12",
            "transgene": "UDAB",
            "product_id": "A",
            "product": "UDAB",
            "product_type": "GMP",
            "anticipated_manufacture_date": "2018-03-15T17:07:07.245Z",
            "date_of_manufacture": "2018-03-15T17:07:07.245Z",
            "qa_assignee": "Mary",
            "number_of_sublots": 1,
            "gmp_or_tox": "G",
            "tevg_pr": "PR",
            "barcode": "A12345353A",
            "cell_line": "123AB",
            "production_grade": "Research",
            "plasmid_name": "AA123: 432r",
            "plasmid_type": "Vector Plasmid",
            "antibiotic_resistance": "ABC",
            "comments": "This is my comments"
        }
    ],
    "comments": [
        "Comment One",
        "Comment Two"
    ]
}